{
 "$schema": "https://json-schema.org/draft/2020-12/schema",
 "title": "JFG-Studio planets/<name>.json",
 "type": "object",
 "required": ["format", "displayName", "disc", "routes", "entryLevel"],
 "additionalProperties": false,
 "properties": {
  "format": {"const": 1},
  "displayName": {"type": "object", "required": ["en"], "additionalProperties": {"type": "string", "minLength": 1}},
  "fixedWorld": {"type": "integer", "minimum": 0, "maximum": 15, "description": "phase 0 only: the world number until the port's planet registry exists"},
  "disc": {
   "type": "object",
   "required": ["index", "x", "y", "radius"],
   "additionalProperties": false,
   "properties": {
    "index": {"type": "integer", "minimum": 0, "maximum": 10, "description": "map disc (8-10 are moons in the stock map)"},
    "x": {"type": "integer"}, "y": {"type": "integer"},
    "radius": {"type": "integer", "minimum": 1},
    "orbitParent": {"type": "integer", "minimum": -1, "description": "-1 = a planet"},
    "baseTexture": {"type": "integer"}, "topTexture": {"type": "integer"}
   }
  },
  "scale": {"type": "number"},
  "routes": {
   "type": "array",
   "minItems": 1,
   "items": {
    "type": "object",
    "required": ["from", "dir", "back"],
    "additionalProperties": false,
    "properties": {
     "from": {"type": "string", "description": "stock:mappoint/<n> or pack:world/<name>"},
     "dir": {"enum": ["left", "right", "up", "down"]},
     "back": {"enum": ["left", "right", "up", "down"]},
     "corners": {"type": "array", "maxItems": 4, "items": {"type": "array", "minItems": 2, "maxItems": 2, "items": {"type": "integer"}}}
    }
   }
  },
  "entryLevel": {
   "type": "object",
   "required": ["vela", "juno", "lupus"],
   "additionalProperties": false,
   "properties": {"vela": {"type": "string"}, "juno": {"type": "string"}, "lupus": {"type": "string"}}
  },
  "unlock": {
   "type": "object",
   "additionalProperties": false,
   "properties": {"newGame": {"type": "array", "items": {"enum": ["vela", "juno", "lupus"]}}}
  }
 }
}
