{
 "disc": {
  "baseTexture": 61,
  "index": 8,
  "orbitParent": -1,
  "radius": 14,
  "x": 60,
  "y": 320
 },
 "displayName": {
  "en": "Gemini"
 },
 "entryLevel": {
  "juno": "pack:level/gemini",
  "lupus": "pack:level/gemini",
  "vela": "pack:level/gemini"
 },
 "fixedWorld": 15,
 "format": 1,
 "routes": [
  {
   "back": "right",
   "corners": [[130, 320], [78, 320]],
   "dir": "left",
   "from": "stock:mappoint/2"
  }
 ],
 "unlock": {
  "newGame": ["juno"]
 }
}
